{
  "run_id": "argus-run-1",
  "generated_at": "2026-10-10T14:53:23.479650Z",
  "dataset": "UNSW-NB15",
  "source_files": [
    {
      "name": "UNSW-NB15_3.csv",
      "size_bytes": 154588103
    },
    {
      "name": "UNSW-NB15_2.csv",
      "size_bytes": 165221021
    },
    {
      "name": "UNSW-NB15_1.csv",
      "size_bytes": 168979718
    },
    {
      "name": "UNSW-NB15_4.csv",
      "size_bytes": 97588754
    }
  ],
  "config": {
    "window_seconds": 1,
    "lookback_windows": 5,
    "min_malicious_flows": 1,
    "max_gap_windows": 60,
    "random_seed": 42
  },
  "models": {
    "lr_current": {},
    "lr_lag": {},
    "rf": {}
  },
  "feature_names": [
    "flow_count",
    "total_bytes",
    "total_packets",
    "unique_src_ip",
    "unique_dst_ip",
    "unique_dst_port",
    "dur_mean",
    "dur_std",
    "dur_max",
    "bytes_mean",
    "bytes_std",
    "bytes_max",
    "frac_tcp",
    "frac_udp",
    "frac_failure",
    "port_diversity",
    "dst_port_entropy",
    "flow_count_lag1",
    "flow_count_lag2",
    "flow_count_lag3",
    "flow_count_lag4",
    "total_bytes_lag1",
    "total_bytes_lag2",
    "total_bytes_lag3",
    "total_bytes_lag4",
    "total_packets_lag1",
    "total_packets_lag2",
    "total_packets_lag3",
    "total_packets_lag4",
    "unique_src_ip_lag1",
    "unique_src_ip_lag2",
    "unique_src_ip_lag3",
    "unique_src_ip_lag4",
    "unique_dst_ip_lag1",
    "unique_dst_ip_lag2",
    "unique_dst_ip_lag3",
    "unique_dst_ip_lag4",
    "unique_dst_port_lag1",
    "unique_dst_port_lag2",
    "unique_dst_port_lag3",
    "unique_dst_port_lag4",
    "dur_mean_lag1",
    "dur_mean_lag2",
    "dur_mean_lag3",
    "dur_mean_lag4",
    "dur_std_lag1",
    "dur_std_lag2",
    "dur_std_lag3",
    "dur_std_lag4",
    "dur_max_lag1",
    "dur_max_lag2",
    "dur_max_lag3",
    "dur_max_lag4",
    "bytes_mean_lag1",
    "bytes_mean_lag2",
    "bytes_mean_lag3",
    "bytes_mean_lag4",
    "bytes_std_lag1",
    "bytes_std_lag2",
    "bytes_std_lag3",
    "bytes_std_lag4",
    "bytes_max_lag1",
    "bytes_max_lag2",
    "bytes_max_lag3",
    "bytes_max_lag4",
    "frac_tcp_lag1",
    "frac_tcp_lag2",
    "frac_tcp_lag3",
    "frac_tcp_lag4",
    "frac_udp_lag1",
    "frac_udp_lag2",
    "frac_udp_lag3",
    "frac_udp_lag4",
    "frac_failure_lag1",
    "frac_failure_lag2",
    "frac_failure_lag3",
    "frac_failure_lag4",
    "port_diversity_lag1",
    "port_diversity_lag2",
    "port_diversity_lag3",
    "port_diversity_lag4",
    "dst_port_entropy_lag1",
    "dst_port_entropy_lag2",
    "dst_port_entropy_lag3",
    "dst_port_entropy_lag4",
    "flow_count_diff",
    "total_bytes_diff"
  ]
}